{
  "$schema": "schemas/skills.schema.json",
  "manifestVersion": "5.0.0",
  "library": {
    "id": "skillcli-public",
    "name": "skillcli Public Catalogue",
    "description": "A public governed catalogue of reusable AI plugins and Markdown skills.",
    "repository": "https://github.com/WillEastbury/skillcli",
    "namespace": "WillEastbury/skillcli",
    "defaultRef": "main",
    "updatePolicy": "notify-only",
    "governance": "Only reviewed plugins merged through the protected repository process are published.",
    "browserSkillId": "skillcli-skill-zero"
  },
  "taxonomy": {
    "roles": [
      {
        "id": "business-user",
        "name": "Business user"
      },
      {
        "id": "developer",
        "name": "Developer"
      },
      {
        "id": "seller",
        "name": "Seller"
      },
      {
        "id": "data-analyst",
        "name": "Data analyst"
      },
      {
        "id": "skill-author",
        "name": "Skill author"
      },
      {
        "id": "library-maintainer",
        "name": "Library maintainer"
      },
      {
        "id": "security-reviewer",
        "name": "Security reviewer"
      }
    ],
    "taskCategories": [
      {
        "id": "skill-discovery",
        "name": "Skill discovery"
      },
      {
        "id": "skill-management",
        "name": "Skill management"
      },
      {
        "id": "skill-authoring",
        "name": "Skill authoring"
      },
      {
        "id": "skill-governance",
        "name": "Skill governance"
      },
      {
        "id": "prompt-engineering",
        "name": "Prompt engineering"
      },
      {
        "id": "data-analysis",
        "name": "Data analysis"
      },
      {
        "id": "sales-productivity",
        "name": "Sales productivity"
      },
      {
        "id": "software-engineering",
        "name": "Software engineering"
      }
    ],
    "maxResults": 10
  },
  "skills": [
    {
      "id": "skillcli-skill-zero",
      "name": "Skill Zero: Library Browser",
      "version": "6.0.0",
      "description": "Orchestrates the managed skillcli command to search, install, remove, and update approved skills across detected agent hosts.",
      "status": "approved",
      "path": "plugins/skillcli-skill-zero/skills/skill-zero",
      "entrypoint": "SKILL.md",
      "roles": [
        "business-user",
        "developer",
        "seller",
        "data-analyst",
        "skill-author",
        "library-maintainer",
        "security-reviewer"
      ],
      "taskCategories": [
        "skill-discovery",
        "skill-management"
      ],
      "keywords": [
        "catalogue",
        "discovery",
        "skills",
        "installer"
      ],
      "runtime": {
        "language": "python",
        "dependencies": []
      },
      "capabilities": {
        "network": [
          "github.com",
          "api.github.com"
        ],
        "filesystem": "read-write",
        "shell": [
          "copilot",
          "gh",
          "skillcli"
        ],
        "mcpServers": [],
        "authentication": [
          "host-managed GitHub access"
        ]
      },
      "source": {
        "type": "internal",
        "repository": "https://github.com/WillEastbury/skillcli",
        "license": "MIT"
      },
      "review": {
        "state": "approved",
        "reviewedBy": [
          "skillcli maintainers"
        ],
        "reviewedAt": "2026-08-05"
      },
      "files": [
        {
          "path": "SKILL.md",
          "sha256": "da2c3a1e6bcadef718a678f18ae581c1850a20040a1fa86fc89715c00a0e2651"
        }
      ]
    },
    {
      "id": "skillcli-skill-one",
      "name": "Skill One: GitHub Intake",
      "version": "4.0.0",
      "description": "Submits a proposed Markdown skill and supporting files on a review branch and opens a governed GitHub issue.",
      "status": "approved",
      "path": "plugins/skillcli-skill-one/skills/skill-one",
      "entrypoint": "SKILL.md",
      "roles": [
        "skill-author",
        "library-maintainer"
      ],
      "taskCategories": [
        "skill-authoring",
        "skill-governance"
      ],
      "keywords": [
        "github",
        "intake",
        "review",
        "submission"
      ],
      "runtime": {
        "language": "none",
        "dependencies": []
      },
      "capabilities": {
        "network": [
          "github.com",
          "api.github.com"
        ],
        "filesystem": "read-write",
        "shell": [
          "git",
          "skillcli"
        ],
        "mcpServers": [],
        "authentication": [
          "host-managed GitHub access"
        ]
      },
      "source": {
        "type": "internal",
        "repository": "https://github.com/WillEastbury/skillcli",
        "license": "MIT"
      },
      "review": {
        "state": "approved",
        "reviewedBy": [
          "skillcli maintainers"
        ],
        "reviewedAt": "2026-08-05"
      },
      "files": [
        {
          "path": "SKILL.md",
          "sha256": "9764d9f1ad878fa7ff5db4d13b036d3a5d67d737ae983a1569629956818b3b05"
        }
      ]
    },
    {
      "id": "skillcli-skill-two",
      "name": "Skill Two: Guided Skill Builder",
      "version": "2.0.1",
      "description": "Builds a new reusable skill from user-approved enterprise evidence when no catalogue skill is suitable.",
      "status": "approved",
      "path": "plugins/skillcli-skill-two/skills/skill-two",
      "entrypoint": "SKILL.md",
      "roles": [
        "business-user",
        "developer",
        "seller",
        "data-analyst",
        "skill-author"
      ],
      "taskCategories": [
        "skill-authoring"
      ],
      "keywords": [
        "authoring",
        "mcp",
        "skill-builder"
      ],
      "runtime": {
        "language": "none",
        "dependencies": []
      },
      "capabilities": {
        "network": [],
        "filesystem": "read-write",
        "shell": [],
        "mcpServers": [
          "dataverse",
          "m365",
          "workiq",
          "other user-approved MCP servers"
        ],
        "authentication": [
          "host-managed MCP access"
        ]
      },
      "source": {
        "type": "internal",
        "repository": "https://github.com/WillEastbury/skillcli",
        "license": "MIT"
      },
      "review": {
        "state": "approved",
        "reviewedBy": [
          "skillcli maintainers"
        ],
        "reviewedAt": "2026-08-05"
      },
      "files": [
        {
          "path": "SKILL.md",
          "sha256": "725e4afdc3c7dd9d29fe6ab5d7769177f8c27200a1d7a8675ba375b9a75a7ad7"
        }
      ]
    },
    {
      "id": "skillcli-prompt-quality-check",
      "name": "Prompt Quality Check",
      "version": "1.0.1",
      "description": "Reviews a prompt for clarity, context, constraints, output shape, and safety before producing an improved version.",
      "status": "approved",
      "path": "plugins/skillcli-prompt-quality-check/skills/prompt-quality-check",
      "entrypoint": "SKILL.md",
      "roles": [
        "business-user",
        "developer",
        "seller",
        "data-analyst",
        "skill-author"
      ],
      "taskCategories": [
        "prompt-engineering"
      ],
      "keywords": [
        "prompt",
        "quality",
        "review"
      ],
      "runtime": {
        "language": "python",
        "dependencies": []
      },
      "capabilities": {
        "network": [],
        "filesystem": "none",
        "shell": [],
        "mcpServers": [],
        "authentication": []
      },
      "source": {
        "type": "internal",
        "repository": "https://github.com/WillEastbury/skillcli",
        "license": "MIT"
      },
      "review": {
        "state": "approved",
        "reviewedBy": [
          "skillcli maintainers"
        ],
        "reviewedAt": "2026-08-05"
      },
      "files": [
        {
          "path": "SKILL.md",
          "sha256": "ae498041bd592c6dc06396ac345586e454babd9ed7db565fcc239ae27da28591"
        },
        {
          "path": "src/prompt_quality.py",
          "sha256": "e94c86842094f3588be4d92770f94140054a7f1b1d8fbb9b6a9a5b96cecc5594"
        }
      ]
    }
  ]
}
